artiId,pub_year,pub_mon,통권,volume,categories,title_ko,title_en,authors
ART002953566,1989,12,1,,철학,Rāma 說話를 通해서 본 Rāma의 化現觀,Rāma 說話를 通해서 본 Rāma의 化現觀,서행정(한국외국어대학교)
ART002953569,1989,12,1,,철학,와이셰시카(勝論)학파의 7범주론 _안남밧따의 《論理 概要》 譯解 (I),와이셰시카(勝論)학파의 7범주론 _안남밧따의 《論理 概要》 譯解 (I),이지수(동국대학교)
ART002953574,1989,12,1,,철학,아포하 論 의 定義 및 ユ 生成背景 _달마끼르띠의 自註 를 중심으로_,아포하 論 의 定義 및 ユ 生成背景 _달마끼르띠의 自註 를 중심으로_ l,전치수(동경대학교)
ART002953578,1989,12,1,,철학,《바가바드 기타》의 즈나나요가에 관한 연구,《바가바드 기타》의 즈나나요가에 관한 연구 l,이태영(동국대 인도철학과)
ART002953612,1992,09,2,,철학,니야-야(正理) 학파의 인식학·논리학 _안남밧따의 《論理 概要》 譯解 (Ⅱ)_,니야-야(正理) 학파의 인식학·논리학 _안남밧따의 《論理 概要》 譯解 (Ⅱ)_ l,이지수(동국대학교)
ART002953616,1992,09,2,,철학,WONHYO'S TRANSFORMATION OF TOTAL INTERPENETRATION,WONHYO'S TRANSFORMATION OF TOTAL INTERPENETRATION,김상일(한신대학교)
ART002953675,1993,11,3,,철학,正理學派의 4가지 인식방법(pramāṇa) 一<正理経> Ⅰ.1. 수뜨라 1-8에 대한 Vātsyāyana<疏>의 譯註一,正理學派의 4가지 인식방법(pramāṇa) 一<正理経> Ⅰ.1. 수뜨라 1-8에 대한 Vātsyāyana<疏>의 譯註一,이지수(동국대학교)
ART002953678,1993,11,3,,철학,원시불교에서 非我의 의미,원시불교에서 非我의 의미 l,정승석(동국대학교)
ART002953691,1993,11,3,,철학,龍樹의 無記觀,龍樹의 無記觀 l,김성철(동국대학교)
ART002953705,1993,11,3,,철학,『顯揚聖教論』에 대한 再考察,『顯揚聖教論』에 대한 再考察 l,최종남(중앙승가대학교)
ART002953708,1993,11,3,,철학,[번역] 융의 심리학과 빠딴쟐리 요가에 있어서 신비주의,융의 심리학과 빠딴쟐리 요가에 있어서 신비주의 (Mysticism in the Psychology of Jung and the Yoga of Patanjali),이지수(동국대학교)
ART002953722,2002,08,1,12,철학,Ethical Foundations of an Urban Age -Śāntideva’s Argument for Altruism-,Ethical Foundations of an Urban Age -Śāntideva’s Argument for Altruism-,Mark Siderits(Illinois State Univ. U.S.A.)
ART002954518,2002,08,1,12,철학,梵我一如 思想 과 緣起說,On the Relations between the Idea of Brahma-ātma-aikya and Pratītyasamutpāda,이호근(강릉원주대학교)
ART002954550,2002,08,1,12,철학,초기 유식학파의 분별 개념,On The Concept of Vikalpa in Early Vijñānavādins,김성철(금강대학교)
ART002954620,2002,02,2,11,철학,빠딴잘리 『요-가·수-뜨라』 ‘三昧品'(Samādhi-pāda)의 思想 (2),On the Theory of Samādhi in the Patañjali’s Yoga-sūtra (2),이지수(동국대학교)
ART002954635,2002,02,2,11,철학,『金剛經』의 禪思想,The Seon Thought in the Vajra-cchedikā-prajñāpāramitāsūtra,이법산(동국대학교)
ART002954646,2002,02,2,11,철학,'존재하지 않음'의 유형과 적용,Types and uses of non-being,박인성(동국대학교)
ART002954670,2002,02,2,11,철학,자이나 철학에서의 業과 靈魂의 관계,The ralation of karma and jiva in Jaina philosophy,김미숙(위덕대학교 밀교문화연구원)
ART002954675,2002,02,2,11,철학,初期 佛教의 緣起說에 나타난 六處(saḷāyatana)의 役割,A role of sālāyatana in paṭiccasamuppāda of Early Buddhism,강신보(동국대학교)
ART002950984,2003,12,2,12,철학,正理學派의 인식방법론 (Ⅰ) _Keśavarniśra의 Tarka-bhāṣā ‘Pramāṇa’ 章의 譯解_,正理學派의 인식방법론 (Ⅰ) _Keśavarniśra의 Tarka-bhāṣā ‘Pramāṇa’ 章의 譯解_,이지수(동국대학교)
ART002950993,2003,12,2,12,철학,붓다고사(Buddhaghosa) 의 誌釋方法예 대란 硏究,A Study on the Exegetical Methodology of Buddhaghosa,백도수(능인대학원대학교)
ART002950996,2003,12,2,12,철학,테라바다(Theravāda)의 공간 개념과 열반,테라바다(Theravāda)의 공간 개념과 열반,황순일(동국대학교)
ART002950997,2002,08,1,12,철학,Ahiṃsā 精神의 史的 展開와 現代的 實踐方案,Historical Development of the Idea of Ahirnsa and Its Practical Method in the contemporary Society,김선근(동국대학교)
ART002950995,2003,12,2,12,철학,인식과 표현 _俱舍論의 서술방식에 관한 一考_,Cognition and Expression -A Study on the Way of Description in the Abhidharmakosabhasyam,강종원(동국대학교)
ART002951072,1994,11,4,,철학,쉬와디띠야(Śivāditya)의 7범주론(Saptapadārthī),쉬와디띠야(Śivāditya)의 7범주론(Saptapadārthī),이지수(동국대학교)
ART002951075,1994,11,4,,철학,인도의 祭祀觀 小考,인도의 祭祀觀 小考 i,김재천(대진대학교)
ART002951077,1994,11,4,,철학,욷달라까 아루니의 sat論에 대한 小考,욷달라까 아루니의 sat論에 대한 小考,이은덕
ART002951079,1994,11,4,,철학,第一義空經과 Vasubandhu(Ⅱ),第一義空經과 Vasubandhu(Ⅱ),서성원(동국대학교)
ART002951085,1995,01,5,,철학,淸辯思想의 再照明_論理學의 收容과 二諦說을 중심으로_,淸辯思想의 再照明_論理學의 收容과 二諦說을 중심으로_   l,이현옥(동국대학교)
ART002951088,1995,01,5,,철학,佛敎에 있어서 環境과 生命倫理,佛敎에 있어서 環境과 生命倫理 l,이법산(동국대학교)
ART002951089,1995,01,5,,철학,간디의 윤리학에 끼친 Rāmānuja의 Bhakti 사상의 영향,간디의 윤리학에 끼친 Rāmānuja의 Bhakti 사상의 영향,김선근(동국대학교)
ART002951090,1995,01,5,,철학,다르마와 베다에 대한 초기 미망사학파의 견해_샤바라 브하샤(Ⅰ.ⅰ.S.1-5)를 중심으로_,다르마와 베다에 대한 초기 미망사학파의 견해_샤바라 브하샤(Ⅰ.ⅰ.S.1-5)를 중심으로_,이지수(동국대학교)
ART002951093,1995,01,5,,철학,近代 日本 佛敎學의 功過,近代 日本 佛敎學의 功過 l,이태승(위덕대학교)
ART002951092,1995,01,5,,철학,Sarvasiddhāntasaṁgraha에 인용된 佛敎學派의 思想史的 考察,Sarvasiddhāntasaṁgraha에 인용된 佛敎學派의 思想史的 考察,임승택(경북대학교)
ART002951208,1996,12,6,,철학,Bhakti-yoga 패러다임으로 본 『法華經』의 觀音信仰 Bhagavad-Gītā 와 『 法華經』을 中心으로,Bhakti-yoga 패러다임으로 본 『法華經』의 觀音信仰 Bhagavad-Gītā 와 『 法華經』을 中心으로,김선근(동국대학교)
ART002951211,1996,12,6,,철학,인도철학에 있어서 착각의 문제_正理學派를 중심으로_,인도철학에 있어서 착각의 문제_正理學派를 중심으로_    l,이지수(동국대학교)
ART002951225,1996,12,6,,철학,密敎 陀羅尼의 機能에 대한 고찰_정통 인도종교의 만트라와 관련하여_,密敎 陀羅尼의 機能에 대한 고찰_정통 인도종교의 만트라와 관련하여_  l,김호성(동국대학교)
ART002951269,1996,12,6,,철학,Śaṅkara의 生解脫論,Śaṅkara의 生解脫論,심봉섭(성균관대학교 동양철학과)
ART002951275,1996,12,6,,철학,미맘사 학파의 제사관,미맘사 학파의 제사관 l,김재천(대진대학교)
ART002951291,1997,12,7,,철학,[논평] 베다의 제례는 제식만능주의인가_김재천과 김호성의 논문에 답하여_,[논평] 베다의 제례는 제식만능주의인가_김재천과 김호성의 논문에 답하여_ l,심재관(상지대학교)
ART002951313,1998,11,8,,철학,요가의 발전과 佛敎에의 受用,요가의 발전과 佛敎에의 受用 l,정태혁(동국대학교)
ART002951314,1998,11,8,,철학,部派佛敎에 있어서 존재문제 : 實有와 假有,部派佛敎에 있어서 존재문제 : 實有와 假有 l,서성원(동국대학교)
ART002951317,1998,11,8,,철학,빠딴잘리 『요가 수-뜨라』 ‘三昧品’(Samādhi-pāda)의 思想,빠딴잘리 『요가 수-뜨라』 ‘三昧品’(Samādhi-pāda)의 思想,이지수(동국대학교)
ART002951322,1998,11,8,,철학,샹까라의 ‘헛됨(mithyā)’과 불교의 刹那說(kṣaṇikavāda)_『브라흐마 수뜨라』샹까라 주석을 바탕으로_,샹까라의 ‘헛됨(mithyā)’과 불교의 刹那說(kṣaṇikavāda)_『브라흐마 수뜨라』샹까라 주석을 바탕으로_,이재숙(한국외국어대학교)
ART002951332,1999,12,9,,철학,『顯揚聖敎論』 品構造에 대해서,『顯揚聖敎論』 品構造에 대해서 l,최종남(중앙승가대학교)
ART002951333,1999,12,9,,철학,샹까라 철학의 māyā 개념 검토 ─Brahmasūtra-Śaṅkarabhāṣya를 중심으로─,샹까라 철학의 māyā 개념 검토─Brahmasūtra-Śaṅkarabhāṣya를 중심으로─,박영길(경북대학교)
ART002951334,1999,12,9,,철학,"[논평] 홍성기의 「분할과 조합, 龍樹의 緣起說과 분석철학」","[논평] 홍성기의 「분할과 조합, 龍樹의 緣起說과 분석철학」 l",김성철(동국대학교)
ART002951330,1999,12,9,,철학,『中論』에 대한 因明學的 註釋의 가능성 ─淸辨(Bhavaviveka)의 試圖와 月稱(Candrakīrti)의 批判─,『中論』에 대한 因明學的 註釋의 가능성 ─淸辨(Bhavaviveka)의 試圖와 月稱(Candrakīrti)의 批判─,김성철(동국대학교)
ART002951609,2000,12,10,,철학,상키야 철학에서 차별의 개념,상키야 철학에서 차별의 개념 l,정승석(동국대학교)
ART002951606,2000,12,10,,철학,Sambandhaparīkṣāvṛtti와 『中論』』,Sambandhaparīkṣāvṛtti와 『中論』,김성철(동국대학교)
ART002951612,2000,12,10,,철학,인도의 고전적 人間像과 근대적 재인식 - 근대 힌두교 개혁운동을 중심으로 -,인도의 고전적 人間像과 근대적 재인식 - 근대 힌두교 개혁운동을 중심으로 - l,이호근(강릉원주대학교)
ART002951615,2001,12,1,11,철학,요가 철학에서 잠재업과 훈습의 관계,요가 철학에서 잠재업과 훈습의 관계 l,정승석(동국대학교)
ART002951618,2001,12,1,11,철학,아드바이따 베단따 철학에 있어서 경험적 의식(saṁvṛti-caitanya)과 순수 의식(cit),아드바이따 베단따 철학에 있어서 경험적 의식(saṁvṛti-caitanya)과 순수 의식(cit),이은주(한국외대 인도어과)
ART002951620,2001,12,1,11,철학,梵語에서의 性(gender)에 관한 개념: Mahābhāṣya를 중심으로,梵語에서의 性(gender)에 관한 개념: Mahābhāṣya를 중심으로,엄혜용(동국대학교)
ART001424084,2010,02,28,,철학,根本說一切有部毘奈耶의 내러티브 고찰⑴_붓다가 말먹이용 보리를 먹은 사연을 중심으로,A Study on the Narrative of the Buddha's Eating of Horse Fodder Barley in the Mūlasarvāstivādin Vinaya ⑴,박청환(중앙승가대학교)
ART002021963,2015,08,44,,철학,인도 심리학의 삼질 성격이론,Triguṇa Theory of Personality in Indian Psychology,문진건(동국대학교)
ART002022096,2015,08,44,,철학,인도와 중국 불교 경론을 통해 본 ‘Buddha-vacana’ 개념의 의미 변천,The Transformation of the Meaning of the Word ‘Buddha-vacana’ in ​the ​Chinese Translat​ions of the Abhidharma Texts and Its Implication​s​,조은수(서울대학교)
ART002022132,2015,08,44,,철학,간화선과 심리치료 - 연구 현황을 중심으로 -,Ganhwaseon and Psychotherapy : Focusing on Current Research Trend,이필원(동국대학교)
ART002022165,2015,08,44,,철학,The Validity of Robinsonian Critiques on Nāgārjunian Logic - Centering on the Interpretation of Catuṣkoṭi -,The Validity of Robinsonian Critiques on Nāgārjunian Logic - Centering on the Interpretation of Catuṣkoṭi -,김태수(서울대학교)
ART002065637,2015,12,45,,철학,『니야야만자리』(Nyāyamañjarī)의 아트만 논증에서 열변용 이론에 대하여,A study on pākajotpattivāda in demonstrations of Ātman in Nyāyamañjarī,박문성(가톨릭대학교)
ART002065645,2015,12,45,,철학,説一切有部에 있어서 四善根 - 信과 斷善根과의 관계를 중심으로 -,The Four Kuśalamūlas in the Sarvāstivāda: A study on the relationship between śraddhā and kuśalamūlasamuccheda,김경희(오타니대학교)
ART002065649,2015,12,45,,철학,"기억(smṛti)과 지식의 2상성(二相性, dvirūpatā)",Recollection and the Two Forms(dvirūpatā) of Knowledge,박기열(한국불교연구원)
ART002065654,2015,12,45,,철학,유식불교의 심리치료적 특징 고찰 - 선행연구 분석과 연구방향 모색 -,Characteristics of Consciousness-only Buddhism from Perspective of Psychotherapy: Research Trends Analysis and Proposal,박재용(동국대학교)
ART002065665,2015,12,45,,철학,꿈꾸는 자와 요가 수행자 - 불교와 쉬바파의 관념론적 상관성,The Dreamer and the Yogin: On the relationship between Buddhist and Śaiva idealisms,정승석(동국대학교)
ART002376692,2018,08,53,,철학,나찌께따스 황금판자(sṛṅkā)의 메타포 분석 __『까따 우빠니샤드』에 나타난 죽음과 제식의 해석적 함의__,Metaphoric Analysis of the Naciketās’ sṛṅkā(golden disc): The Hermeneutic Implications of the Death and the Ritual in the KU,김진영(서강대학교 철학연구소)
ART002376715,2018,08,53,,철학,고전요가에서의 기억__Yogasūtrabhāṣya 1.11의 해석을 중심으로__,Memory in Classical Yoga: Focusing on Yogasūtrabhāṣya 1.11,강형철(동국대학교 인도철학불교학연구소)
ART002376716,2018,08,53,,철학,고대인도 슈라마니즘의 윤리 논쟁__불교 『우팔리경』(Upāli-sutta)을 중심으로__,An Ethical Debate of Śramanism in Ancient India: focus on Upāli-sutta,최지연(한국외국어대학교 인도연구소)
ART002376720,2018,08,53,,철학,바마하(Bhāmaha)의 ‘의미의 수사법’(arthālaṃkāra)에 대하여 (I)__『카비야알람카라』(Kāvyālaṃkāra) 제2장을 중심으로__,Bhāmaha’s Arthālaṃkāras (I): Especially in the 2nd Pariccheda of Kāvyālaṃkāra,류현정(가톨릭대학교)
ART002376726,2018,08,53,,철학,공과 나의 현전(現前)__『중론』과 『보살지』 「진실의품」의 공성 이해를 중심으로__,"Emptiness and My Present Existence: based on the Understanding of Emptiness of Madhyamaka-śāstra, Tattvārthapaṭala of the Bodhisattvabhūmi",윤종갑(동아대학교)
ART002341758,2018,04,52,,철학,식의 자기인식(Self-awareness)과 삼성설,Theory of the Self-Awareness of Consciousness and Three Characteristics in the Saṃdhinirmocanasūtra,안성두(서울대학교)
ART002341760,2018,04,52,,철학,니야야 학파의 인식수단과 인식결과에 대한 지넨드라붓디의 검증,Buddhist examination of Nyāya’s pramāṇa and phala in Pramāṇasamuccayaṭīkā 112.12-117.4,박기열(금강대학교 불교문화연구소)
ART002341764,2018,04,52,,철학,초기불교 공(空) 개념의 수행적 성격__빠알리 니까야를 중심으로__,Empty concept in Early Buddhism: Focusing on mental training,박재은(서울불교대학원대학교)
ART002421545,2018,12,54,,철학,고대 인도의 제식에서 아그니의 다양한 역할,On the Various Ritual Roles of Agni in Ancient India,박문성(가톨릭대학교)
ART002421562,2018,12,54,,철학,불교 딴뜨라 문헌이 전하는 샤이바(Śaiva) 의례의 도입과 해석,Adoption and Assimilation of Śaiva Rituals as Seen in Buddhist Tantric Texts,방정란(大正大学)
ART002421581,2018,12,54,,철학,"한국불교 의례의 인도적 연원의 의의_재(齋), 포살(布薩), Upavasatha_","The Indian Origion of Korean Buddhist Rituals: Ceremony, Upoṣadha, Upavasatha",성청환(동국대학교)
ART002421680,2018,12,54,,철학,라마 이야기 전통에서 뜨리자따의 변모 양상과 다르마,Literary Transformation of Rākṣasī Trijaṭā in Rāma-kathā Tradition and Dharma,이동원(한국외국어대학교)
ART002461265,2019,04,55,,철학,성스러움과 합리성의 교차점__수행 전통을 통해 본 인도 사유의 종교와 철학__,The Intersection between Sacredeness and Rationality: Religion and Philosophy of Indian based on Practical Tradition,성청환(동국대학교)
ART001476681,2010,08,29,,철학,범･장･돈황본 아미타경 대조 연구,"A Comparative Study of the Sanskrit, Tibetan and Dunhuang Versions of Sukhāvatī-Vyūha",최종남(중앙승가대학교)
ART001476684,2010,08,29,,철학,바가바드기따(Bhagavadgītā)의 보편성 : 까르마요가(karma-yoga)를 중심으로,The Universality of the Bhagavadgītā,이거룡(선문대학교)
ART001476686,2010,08,29,,철학,비베카난다의 붓다관에 대한 비평 : 遊行(sannyāsa)과 出家(pabbajjā)를 중심으로,Criticism on Vivekananda's view of Buddha Focused on Sannyāsa and Pabbajjā,김호성(동국대학교)
ART001476690,2010,08,29,,철학,龍樹 中論의 禪的 考察,A Study on the Seon Aspect of the Nāgārjuna's Madhyamaka Kārikā,이법산(동국대학교)
ART001476696,2010,08,29,,철학,짠드라끼르띠의 이제설과 언어관,The Two Truths Theory and Theory of Language in Candrakīrti,윤희조(서울불교대학원대학교)
ART001549228,2011,04,31,,철학,초기불교 교단의 食에 대하여,Studies on Eating of Buddhist community of the Early Buddhism,신성현(동국대학교)
ART001549230,2011,04,31,,철학,"거품, 어스름, 그리고 해변 : 인도 신화 속에 나타난 신들의 속임수와 경계성",God's Trickery and Liminality in the Hindu Myth,심재관(금강대학교)
ART001549233,2011,04,31,,철학,종교적 신념에 대한 엘리스(Ellis)의 비판과 붓다의 가르침,Albert Ellis' Critique of Religious beliefs and the Teachings of the Buddha,안양규(동국대학교)
ART001549235,2011,04,31,,철학,돈오점수(頓悟漸修)와 초기불교의 수행,On Early Buddhist Practice from the viewpoint of Sudden Enlightenment Gradual Cultivation(頓悟漸修),임승택(경북대학교)
ART001549238,2011,04,31,,철학,구사론 파아품에 나타난 자아논증과 그 비판,An argument for the demonstration of ātman in the ninth chapter of the Abhidharmakośabhāṣya,황순일(동국대학교)
ART001549239,2011,04,31,,철학,"현장(玄奘)의 음역어, 마게타(摩揭陀)에 관한 고찰",A Study of Mo jie tuo(摩揭陀) Transliterated into Chinese by Xuan Zang,공만식(동국대학교)
ART001549241,2011,04,31,,철학,아시아 근대불교와 문화제국주의 비판 : 근대 영국의 문화제국주의와 인도불교의 학문화 과정,Critique of Cultural Imperialism and Modern Buddhism in Asia: Establishment of Buddhist Studies in Modern India and British Cultural Imperialism,김진영(동국대학교)
ART002138525,2016,08,47,,철학,고전기 이전 상키야 철학에 대한 Yuktidīpikā 저자의 역사 인식,The Historical Perspective of Yuktidīpikā-Kāra about Pre-classical Sāṃkhya System,강형철(금강대학교 불교문화연구소)
ART002138531,2016,08,47,,철학,쉬바계 뿌라나(Śaiva Purāṇa)의 링가 숭배 양상 - 링가(liṅga)의 의미와 기원을 중심으로 -,The Aspect of Liṅga - Worship in Śaiva Purāṇa,김현덕(동국대학교)
ART002138532,2016,08,47,,철학,현대요가는 하타요가와 같은 것인가?,Is Modern Yoga equal to Haṭha Yoga?,심준보(동국대학교)
ART002104090,2016,04,46,,철학,하타 요가(Haṭha Yoga)의 미세 신체관 - 초기 하타 요가 문헌에 나타난 차크라(cakra) 관념을 중심으로 -,A Study on a View of Subtle Body in Haṭha Yoga: focused on the Idea of Cakra in Early Haṭha Yoga Texts,김재민(동국대학교)
ART002104093,2016,04,46,,철학,"우빠니샤드에서의 행복과 불행의 신화적 구조 - 태양, 신화, 지식의 메타포를 중심으로 -","The Mythical Frame of Happiness and Unhappiness in the Upanishads : Focused on The sun, Myths, Knowledge Metaphor",김진영(서강대학교 철학연구소)
ART002104108,2016,04,46,,철학,4종성(四種姓) 제도에 대한 붓다의 태도와 암베드까르의 해석,The Buddha’s Attitude towards Caturvarṇa System and B. R. Ambedkar’s Interpretation,우명주(동국대학교)
ART002104130,2016,04,46,,철학,『집량론(集量論)』과 『기신론(起信論)』의 귀경게(歸敬偈) 비교,The Maṅgalaśloka of the Pramāṇasamucaya and the Dasheng Qixin Lun,성청환(동국대학교)
ART002796792,2021,12,63,,철학,‘따뜨 뜨밤 아시’(tat tvam asi)에 대한 두 가지 해석 방법과 범아일여의 숨은 논리,Two Methods of Interpretation on ‘tat tvam asi’ and the Hidden Logic of the Oneness between Brahman and Ātman,박효엽(부산대학교)
ART002796794,2021,12,63,,철학,당대(唐代) 돈황 막고굴(敦煌 莫高窟) 관경변상도(觀經變相圖)에 대한 고찰,Study on Tang Dynasty‘s Gwangyeongbyeonsangdo (觀經變相圖) of Dunhuang Mogao Caves,김선희(동국대학교 전자불전문화콘텐츠연구소)
ART002796796,2021,12,63,,철학,소셜미디어에서 나타나는 사이버 힌두뜨바 활동 양상과 그 영향,The Patterns of Cyber Hindutva Activities on Social Media and Its Repercussions,상연진(한국외국어대학교 인도연구소) ; 김민영(인도 자와할랄 네루대학교)
ART002796807,2021,12,63,,철학,Rāhu와 Ketu에 대한 불교와 중국의 인식,The Recognition on Rāhu and Ketu of Buddhism and China,류범선(동국대학교) ; 정승석(동국대학교)
ART002618545,2020,08,59,,철학,맹세와 실행으로 완성되는 詩의 논리:『카비야 알람카라』(Kāvyālaṃkāra) 제5장을 중심으로,Poetic Logic as Vow and its Accomplishment: in the 5th Chapter of the Kāvyālaṃkāra of Bhāmaha,류현정(서울대학교)
ART002618629,2020,08,59,,철학,샹까라의 체계에서 범아일여의 의미와 양상: 『브라흐마 수뜨라 주석』을 중심으로,The Meanings and Aspects of the Identity between Brahman and Ātman in Saṅkara’s System: Focusing on Brahmasūtra-bhāṣya,박효엽(경북대학교)
ART002618744,2020,08,59,,철학,『보리도차제대론』에 나타나는 승의자성의 의미,On the Meaning of Pāramārtha-svabhāva in Tsong-kha-pa’s Lam Rim Chen Mo,이태승(위덕대학교)
ART002950987,2003,12,2,12,철학,埼伽師抽論에 있어 ‘128종 隨眠(anuśaya) ’說의 칭립과 그 특징,Die Klassifikation der 128 Abarten der anusayas in der Yogacarabhumi,안성두(서울대학교)
ART002951076,1994,11,4,,철학,바가바드기따의 제사관-불교의례의 재검토를 위한 定礎로서-,바가바드기따의 제사관-불교의례의 재검토를 위한 定礎로서-  l,김호성(동국대학교)
ART002951083,1995,01,5,,철학,무아 윤회의 反불교적 예증,무아 윤회의 反불교적 예증 l,정승석(동국대학교)
ART002951091,1995,01,5,,철학,"業說과 恩寵의 양립 문제_라마누자의 박띠(bhakti, 信愛)를 중심으로_","業說과 恩寵의 양립 문제_라마누자의 박띠(bhakti, 信愛)를 중심으로_",이거룡(선문대학교)
ART002951215,1996,12,6,,철학,즈냐나가르바의 二諦說에 대하여,.즈냐나가르바의 二諦說에 대하여 l,이태승(위덕대학교)
ART002951320,1998,11,8,,철학,『中觀莊嚴論』의 形象說에 대하여,『中觀莊嚴論』의 形象說에 대하여 l,이태승(위덕대학교)
ART002953540,1989,12,1,,철학,간디의 宗敎觀 硏究,간디의 宗敎觀 硏究 l,김선근(동국대학교)
ART002953598,1992,09,2,,철학,요가수행에 대한 고찰,요가수행에 대한 고찰 l,이태영(동국대학교)
ART002953697,1993,11,3,,철학,『二諦分別論』에 있어서 유가행파 批判에 대하여,『二諦分別論』에 있어서 유가행파 批判에 대하여 l,이태승(위덕대학교)
ART002954537,2002,08,1,12,철학,瑜伽行派에 있어 見道 (darśana-mārga)說 (1),Der Darśana-mārga der Yogācāra-Schule (1),안성두(서울대학교)
ART002954608,2002,08,1,12,철학,The Case of Vegetarianism _A Buddhist Perspective_,The Case of Vegetarianism _A Buddhist Perspective_,Lambert Schmithausen(Hamburg University)
ART001946053,2014,12,42,,철학,일본 근대 인도철학의 성립과 하라 탄잔(原坦山)의 역할,The Formation of the Study of Indian Philosophy in Modern Japan and the Role of Tanzan Hara,이태승(위덕대학교)
ART001946105,2014,12,42,,철학,파니니(Pāṇini) 문법의 형태론 ＿단어(pada) ; 어기(語基)와 접사(pratyaya)＿,The Morphological character of word(pada) in Aṣṭādhyāyī,김현덕(동국대학교)
ART001946204,2014,12,42,,철학,<삼무성론>에 나타난 진제의 삼성설 해석의 특징 (II) ＿유식문헌의 인용과 그 해석상의 차이를 중심으로＿,Characteristics of Paramārtha's Trisvabhāva Theory: in San wu hsing lun with reference to Indian Yogācāra texts (II),안성두(서울대학교)
ART001946313,2014,12,42,,철학,<密意解明(dGongs pa rab gsal)>에 나타난 중관학파의 부정대상(dgag bya),The Object of Negation from Illumination of the Thought(dGongs pa rab gsal),박영란(동국대학교)
ART001987249,2015,04,43,,철학,‘낙(樂) 등’의 심리현상에 대한 불교인식론의 논증 (Ⅰ) - 『量評釋』의 정리·승론학파 견해 검증을 중심으로 -,A Buddhist demonstration on pleasure etc. as psychological phenomena : from Dharmakīrti’s epistemological examination to Nyāya-Vaiśeṣika’s pleasure,박기열(동국대학교)
